{
  "$schema": "http://json-schema.org/draft-07/schema#",
  "$id": "https://agentsgameframework.dev/schemas/material.schema.json",
  "title": "AGF Material Manifest",
  "type": "object",
  "additionalProperties": false,
  "required": ["id", "shader", "color"],
  "properties": {
    "id": {
      "type": "string",
      "pattern": "^[a-z][a-z0-9-]*$",
      "description": "Stable kebab-case material id, unique within the project."
    },
    "shader": {
      "enum": ["standard", "physical", "lambert", "phong", "basic", "custom"],
      "description": "Shader pipeline. `standard` = MeshStandardMaterial (PBR baseline). `physical` = MeshPhysicalMaterial (adds clearcoat / transmission / sheen / iridescence). `lambert` / `phong` are cheap diffuse / specular paths. `basic` is unlit (UI billboards, particles, debug). `custom` (M21-mat-custom) constructs a Three.js `ShaderMaterial` from inline `vertexShader` + `fragmentShader` GLSL strings + an optional `uniforms` map. Hex-string values in `uniforms` (e.g. `#4af0a8`) are parsed as colours; numeric / array values pass through."
    },
    "color": {
      "type": "string",
      "pattern": "^#[0-9a-fA-F]{6}$",
      "description": "Base color, six-digit hex (e.g. #f7c948)."
    },
    "roughness": {
      "type": "number",
      "minimum": 0,
      "maximum": 1,
      "description": "Surface roughness in [0, 1]; 0 = mirror-smooth, 1 = fully diffuse."
    },
    "metalness": {
      "type": "number",
      "minimum": 0,
      "maximum": 1,
      "description": "Metallic factor in [0, 1]; 0 = dielectric, 1 = metal."
    },
    "emissive": {
      "type": "string",
      "pattern": "^#[0-9a-fA-F]{6}$",
      "description": "Emissive color, six-digit hex. Defaults to #000000 (non-emissive)."
    },
    "alphaMode": {
      "enum": ["opaque", "blend"],
      "description": "Blend mode. v0 supports opaque and standard alpha blending."
    },
    "opacity": {
      "type": "number",
      "minimum": 0,
      "maximum": 1,
      "description": "Material alpha in [0, 1]. Pair with `alphaMode: blend` for transparency. Defaults to 1."
    },
    "clearcoat": {
      "type": "number",
      "minimum": 0,
      "maximum": 1,
      "description": "MeshPhysicalMaterial only. 0..1 thin clearcoat layer intensity (car paint, lacquer)."
    },
    "clearcoatRoughness": {
      "type": "number",
      "minimum": 0,
      "maximum": 1,
      "description": "MeshPhysicalMaterial only. Roughness of the clearcoat layer."
    },
    "ior": {
      "type": "number",
      "exclusiveMinimum": 0,
      "description": "MeshPhysicalMaterial only. Index of refraction (~1.45 for glass, ~1.33 for water)."
    },
    "transmission": {
      "type": "number",
      "minimum": 0,
      "maximum": 1,
      "description": "MeshPhysicalMaterial only. 0..1 light transmission factor for refractive surfaces."
    },
    "thickness": {
      "type": "number",
      "minimum": 0,
      "description": "MeshPhysicalMaterial only. Approximate thickness for transmissive volumes."
    },
    "sheen": {
      "type": "number",
      "minimum": 0,
      "maximum": 1,
      "description": "MeshPhysicalMaterial only. 0..1 sheen layer intensity (fabric, velvet)."
    },
    "sheenColor": {
      "type": "string",
      "pattern": "^#[0-9a-fA-F]{6}$",
      "description": "MeshPhysicalMaterial only. Sheen tint."
    },
    "iridescence": {
      "type": "number",
      "minimum": 0,
      "maximum": 1,
      "description": "MeshPhysicalMaterial only. 0..1 iridescence intensity (soap bubble, oil slick)."
    },
    "shininess": {
      "type": "number",
      "minimum": 0,
      "description": "MeshPhongMaterial only. Specular highlight tightness; higher = sharper."
    },
    "specular": {
      "type": "string",
      "pattern": "^#[0-9a-fA-F]{6}$",
      "description": "MeshPhongMaterial only. Specular highlight tint."
    },
    "map": {
      "type": "string",
      "minLength": 1,
      "description": "Base color texture path (`runtime/textures/...`). Multiplies with `color`. Loaded via the shared TextureLoader; KTX2-encoded files route through the singleton KTX2Loader."
    },
    "normalMap": {
      "type": "string",
      "minLength": 1,
      "description": "Tangent-space normal map (RGB, blue-purple). Tangents are auto-generated by Three when missing. Use `bumpMap` instead for greyscale height maps."
    },
    "normalScale": {
      "type": "number",
      "description": "Scale applied to the normal map's XY components. Default 1."
    },
    "bumpMap": {
      "type": "string",
      "minLength": 1,
      "description": "Greyscale height map. Three derives per-pixel normals from the gradient — cheaper to author than a tangent-space normal map. Pair with `bumpScale`."
    },
    "bumpScale": {
      "type": "number",
      "description": "Scalar on the bump-map height derivative. Three.js default is 1; smaller values flatten the relief."
    },
    "roughnessMap": {
      "type": "string",
      "minLength": 1,
      "description": "Greyscale roughness texture. Sampled on the green channel per glTF convention."
    },
    "metalnessMap": {
      "type": "string",
      "minLength": 1,
      "description": "Greyscale metalness texture. Sampled on the blue channel per glTF convention."
    },
    "emissiveMap": {
      "type": "string",
      "minLength": 1,
      "description": "Emissive color texture. Multiplied with `emissive` colour and `emissiveIntensity`."
    },
    "emissiveIntensity": {
      "type": "number",
      "minimum": 0,
      "description": "Scalar on the emissive contribution. Defaults to 1."
    },
    "aoMap": {
      "type": "string",
      "minLength": 1,
      "description": "Ambient occlusion texture. Sampled on the red channel per glTF convention."
    },
    "vertexShader": {
      "type": "string",
      "minLength": 1,
      "description": "M21-mat-custom only. Inline GLSL vertex source for ShaderMaterial. Prefer `vertexShaderRef` when the shader lives in an external file."
    },
    "fragmentShader": {
      "type": "string",
      "minLength": 1,
      "description": "M21-mat-custom only. Inline GLSL fragment source. Prefer `fragmentShaderRef` for external files."
    },
    "vertexShaderRef": {
      "type": "string",
      "minLength": 1,
      "description": "M21-mat-shader-files: relative path to a `.vert` / `.glsl` text file under the project's `assets/` tree. MaterialBindingSystem fetches the file and inlines its contents as `vertexShader` before constructing the ShaderMaterial. Takes precedence over `vertexShader` when both are set."
    },
    "fragmentShaderRef": {
      "type": "string",
      "minLength": 1,
      "description": "M21-mat-shader-files: relative path to a `.frag` / `.glsl` text file."
    },
    "uniforms": {
      "type": "object",
      "description": "M21-mat-custom only. Per-uniform initial value. String hex (`#4af0a8`) is parsed as a Color; number / number-array values pass through.",
      "additionalProperties": {
        "oneOf": [
          { "type": "number" },
          { "type": "string", "minLength": 1 },
          {
            "type": "array",
            "items": { "type": "number" },
            "minItems": 1,
            "maxItems": 16
          }
        ]
      }
    },
    "defines": {
      "type": "object",
      "description": "M21-mat-custom only. #define directives spliced into the GLSL preamble. Values are stringified before substitution.",
      "additionalProperties": { "type": "string" }
    }
  }
}
